{
  "lens_id": "pfizer_public_v0_1",
  "company": "Pfizer",
  "canonical_company_name": "Pfizer",
  "lens_status": "LIGHTWEIGHT_SCAN",
  "visibility": "PUBLIC_COMPANY_LENS",
  "version": "0.1.0-public-release-candidate",
  "source_cutoff": "2026-10-19",
  "industries": [
    "healthcare",
    "pharma",
    "biotechnology",
    "life sciences"
  ],
  "regions": [
    "north_america",
    "global"
  ],
  "company_stage": "large public pharmaceutical and biotechnology company",
  "culture_principles": [
    {
      "name": "Public mission and customer-impact alignment",
      "description": "Pfizer fit should connect work to the company outcomes and users described in cited public sources.",
      "confidence": 0.72,
      "evidence_ids": [
        "PFIZER-OFFICIAL-001",
        "PFIZER-CAREERS-002"
      ]
    },
    {
      "name": "Evidence-backed execution",
      "description": "Strong answers should show practical judgment, clear tradeoffs, ownership, and outcomes rather than generic enthusiasm.",
      "confidence": 0.68,
      "evidence_ids": [
        "PFIZER-OFFICIAL-001",
        "PFIZER-CAREERS-002",
        "PFIZER-IR-003"
      ]
    },
    {
      "name": "Patient impact as the decision anchor",
      "description": "Public material frames the business around patients, which makes speed to patient benefit a legitimate argument in tradeoffs.",
      "confidence": 0.7,
      "evidence_ids": [
        "PFIZER-OFFICIAL-001",
        "PFIZER-IR-003"
      ]
    },
    {
      "name": "Science-led with regulatory discipline",
      "description": "Public positioning pairs scientific innovation with regulatory and quality obligations, so evidence standards are not negotiable for speed.",
      "confidence": 0.72,
      "evidence_ids": [
        "PFIZER-IR-003",
        "PFIZER-CAREERS-002"
      ]
    },
    {
      "name": "Scale as a capability, not just size",
      "description": "The company publicly emphasizes manufacturing and distribution reach, which puts supply reliability alongside discovery work.",
      "confidence": 0.66,
      "evidence_ids": [
        "PFIZER-OFFICIAL-001",
        "PFIZER-IR-003"
      ]
    }
  ],
  "aims_weighting": {
    "structured_thinking": 0.1667,
    "analytical_problem_solving": 0.1667,
    "ownership_execution": 0.1667,
    "impact_results": 0.1667,
    "collaboration_communication": 0.1667,
    "growth_mindset": 0.1665
  },
  "hiring_signals": [
    {
      "signal": "Connects decisions to the users, customers, products, or markets named in public company sources.",
      "aims_dimensions": [
        "impact_results",
        "structured_thinking"
      ],
      "confidence": 0.7,
      "evidence_ids": [
        "PFIZER-OFFICIAL-001",
        "PFIZER-CAREERS-002"
      ]
    },
    {
      "signal": "Uses concrete examples to show ownership, learning, and measurable improvement.",
      "aims_dimensions": [
        "ownership_execution",
        "analytical_problem_solving",
        "growth_mindset"
      ],
      "confidence": 0.68,
      "evidence_ids": [
        "PFIZER-OFFICIAL-001",
        "PFIZER-CAREERS-002",
        "PFIZER-IR-003"
      ]
    },
    {
      "signal": "Describes a decision where regulatory or quality evidence set the pace rather than the deadline.",
      "aims_dimensions": [
        "structured_thinking",
        "ownership_execution"
      ],
      "confidence": 0.72,
      "evidence_ids": [
        "PFIZER-IR-003",
        "PFIZER-CAREERS-002"
      ]
    },
    {
      "signal": "Shows cross-functional collaboration between scientific, manufacturing, and commercial groups with named ownership.",
      "aims_dimensions": [
        "collaboration_communication",
        "analytical_problem_solving"
      ],
      "confidence": 0.68,
      "evidence_ids": [
        "PFIZER-CAREERS-002",
        "PFIZER-OFFICIAL-001"
      ]
    },
    {
      "signal": "Presents data with its limitations and states what additional evidence would change the decision.",
      "aims_dimensions": [
        "analytical_problem_solving",
        "growth_mindset"
      ],
      "confidence": 0.7,
      "evidence_ids": [
        "PFIZER-IR-003",
        "PFIZER-CAREERS-002"
      ]
    }
  ],
  "anti_signals": [
    {
      "anti_signal": "Generic admiration for the company without a concrete role, customer, product, or business mechanism.",
      "risk_reason": "Public lens usage should stay grounded in cited source signals and role-relevant evidence.",
      "confidence": 0.66,
      "evidence_ids": [
        "PFIZER-OFFICIAL-001",
        "PFIZER-CAREERS-002",
        "PFIZER-IR-003"
      ]
    },
    {
      "anti_signal": "Assuming pharmaceutical research, manufacturing, and commercial roles share one evaluation standard.",
      "risk_reason": "Public sources describe distinct functions with different development cycles and metrics.",
      "confidence": 0.71,
      "evidence_ids": [
        "PFIZER-OFFICIAL-001",
        "PFIZER-CAREERS-002"
      ]
    },
    {
      "anti_signal": "Using public vaccine or product messaging as evidence of internal team culture.",
      "risk_reason": "Product communication is not a valid signal about internal ways of working.",
      "confidence": 0.69,
      "evidence_ids": [
        "PFIZER-IR-003"
      ]
    }
  ],
  "interview_patterns": [
    {
      "pattern": "Use cited public source signals to test role-relevant judgment, ownership, communication, and impact.",
      "role_families": [
        "all"
      ],
      "aims_dimensions": [
        "structured_thinking",
        "ownership_execution",
        "impact_results"
      ],
      "confidence": 0.62
    }
  ],
  "evidence_summary": {
    "source_count": 3,
    "official_source_count": 3,
    "interview_source_count": 0,
    "employee_voice_source_count": 0,
    "last_reviewed": "2026-10-19"
  },
  "honest_limits": [
    "This is a lightweight public-source lens and does not represent an official Pfizer hiring standard.",
    "It contains source metadata and non-verbatim public-safe signals only.",
    "Role, team, seniority, location, and hiring manager can materially change interview emphasis.",
    "This lens requires deeper multi-source validation before being promoted to FULLY_DISTILLED."
  ]
}
