{
  "lens_id": "johnson-johnson_public_v0_1",
  "company": "Johnson & Johnson",
  "canonical_company_name": "Johnson & Johnson",
  "lens_status": "LIGHTWEIGHT_SCAN",
  "visibility": "PUBLIC_COMPANY_LENS",
  "version": "0.1.0-public-release-candidate",
  "source_cutoff": "2026-10-19",
  "industries": [
    "healthcare",
    "pharma",
    "medical devices",
    "life sciences"
  ],
  "regions": [
    "north_america",
    "global"
  ],
  "company_stage": "large public healthcare, pharmaceutical, and medical technology company",
  "culture_principles": [
    {
      "name": "Public mission and customer-impact alignment",
      "description": "Johnson & Johnson fit should connect work to the company outcomes and users described in cited public sources.",
      "confidence": 0.72,
      "evidence_ids": [
        "JOHNSON_JOHNSON-OFFICIAL-001",
        "JOHNSON_JOHNSON-CAREERS-002"
      ]
    },
    {
      "name": "Evidence-backed execution",
      "description": "Strong answers should show practical judgment, clear tradeoffs, ownership, and outcomes rather than generic enthusiasm.",
      "confidence": 0.68,
      "evidence_ids": [
        "JOHNSON_JOHNSON-OFFICIAL-001",
        "JOHNSON_JOHNSON-CAREERS-002",
        "JOHNSON_JOHNSON-IR-003"
      ]
    },
    {
      "name": "Responsibility ordered by stakeholder",
      "description": "The company's long-standing public credo orders responsibility toward patients, then employees, communities, and shareholders, which shapes how tradeoffs are justified.",
      "confidence": 0.73,
      "evidence_ids": [
        "JOHNSON_JOHNSON-OFFICIAL-001",
        "JOHNSON_JOHNSON-IR-003"
      ]
    },
    {
      "name": "Decentralized operating responsibility",
      "description": "Public structure describes operating companies with meaningful local ownership, so decisions often sit closer to the product and market than to a single centre.",
      "confidence": 0.66,
      "evidence_ids": [
        "JOHNSON_JOHNSON-OFFICIAL-001",
        "JOHNSON_JOHNSON-CAREERS-002"
      ]
    },
    {
      "name": "Evidence and compliance in equal measure",
      "description": "Health products operate under regulatory scrutiny, making documentation, safety reporting, and reproducible evidence part of ordinary delivery.",
      "confidence": 0.71,
      "evidence_ids": [
        "JOHNSON_JOHNSON-IR-003",
        "JOHNSON_JOHNSON-CAREERS-002"
      ]
    }
  ],
  "aims_weighting": {
    "structured_thinking": 0.1667,
    "analytical_problem_solving": 0.1667,
    "ownership_execution": 0.1667,
    "impact_results": 0.1667,
    "collaboration_communication": 0.1667,
    "growth_mindset": 0.1665
  },
  "hiring_signals": [
    {
      "signal": "Connects decisions to the users, customers, products, or markets named in public company sources.",
      "aims_dimensions": [
        "impact_results",
        "structured_thinking"
      ],
      "confidence": 0.7,
      "evidence_ids": [
        "JOHNSON_JOHNSON-OFFICIAL-001",
        "JOHNSON_JOHNSON-CAREERS-002"
      ],
      "basis": "generic_public_default"
    },
    {
      "signal": "Uses concrete examples to show ownership, learning, and measurable improvement.",
      "aims_dimensions": [
        "ownership_execution",
        "analytical_problem_solving",
        "growth_mindset"
      ],
      "confidence": 0.68,
      "evidence_ids": [
        "JOHNSON_JOHNSON-OFFICIAL-001",
        "JOHNSON_JOHNSON-CAREERS-002",
        "JOHNSON_JOHNSON-IR-003"
      ],
      "basis": "generic_public_default"
    },
    {
      "signal": "Explains a decision where patient safety or regulatory obligation overrode a commercial or schedule goal.",
      "aims_dimensions": [
        "ownership_execution",
        "structured_thinking"
      ],
      "confidence": 0.73,
      "evidence_ids": [
        "JOHNSON_JOHNSON-OFFICIAL-001",
        "JOHNSON_JOHNSON-IR-003"
      ],
      "basis": "derived_public_inference"
    },
    {
      "signal": "Shows cross-functional work between scientific, clinical, quality, and commercial groups with clear ownership.",
      "aims_dimensions": [
        "collaboration_communication",
        "analytical_problem_solving"
      ],
      "confidence": 0.68,
      "evidence_ids": [
        "JOHNSON_JOHNSON-CAREERS-002",
        "JOHNSON_JOHNSON-OFFICIAL-001"
      ],
      "basis": "derived_public_inference"
    },
    {
      "signal": "Presents a result with its uncertainty and the evidence that would change the conclusion.",
      "aims_dimensions": [
        "analytical_problem_solving",
        "growth_mindset"
      ],
      "confidence": 0.7,
      "evidence_ids": [
        "JOHNSON_JOHNSON-IR-003",
        "JOHNSON_JOHNSON-CAREERS-002"
      ],
      "basis": "derived_public_inference"
    }
  ],
  "anti_signals": [
    {
      "anti_signal": "Generic admiration for the company without a concrete role, customer, product, or business mechanism.",
      "risk_reason": "Public lens usage should stay grounded in cited source signals and role-relevant evidence.",
      "confidence": 0.66,
      "evidence_ids": [
        "JOHNSON_JOHNSON-OFFICIAL-001",
        "JOHNSON_JOHNSON-CAREERS-002",
        "JOHNSON_JOHNSON-IR-003"
      ]
    },
    {
      "anti_signal": "Treating pharmaceutical R&D and medtech engineering as one hiring bar or one working model.",
      "risk_reason": "Public sources describe separate segments with different development cycles and constraints.",
      "confidence": 0.71,
      "evidence_ids": [
        "JOHNSON_JOHNSON-OFFICIAL-001",
        "JOHNSON_JOHNSON-IR-003"
      ]
    },
    {
      "anti_signal": "Citing the credo as proof of a specific internal practice without a public source.",
      "risk_reason": "The lens records public statements only and cannot verify internal practice.",
      "confidence": 0.72,
      "evidence_ids": [
        "JOHNSON_JOHNSON-OFFICIAL-001"
      ]
    }
  ],
  "interview_patterns": [
    {
      "pattern": "Use cited public source signals to test role-relevant judgment, ownership, communication, and impact.",
      "role_families": [
        "all"
      ],
      "aims_dimensions": [
        "structured_thinking",
        "ownership_execution",
        "impact_results"
      ],
      "confidence": 0.62
    },
    {
      "pattern": "Hiring signals in this lens are derived interview-preparation suggestions: they translate public company positioning into questions a candidate can prepare for, and are not evidence that the company evaluates candidates on them.",
      "role_families": [
        "all"
      ],
      "aims_dimensions": [
        "growth_mindset",
        "structured_thinking"
      ],
      "confidence": 0.6
    }
  ],
  "evidence_summary": {
    "source_count": 3,
    "official_source_count": 3,
    "interview_source_count": 0,
    "employee_voice_source_count": 0,
    "last_reviewed": "2026-10-19"
  },
  "honest_limits": [
    "This is a lightweight public-source lens and does not represent an official Johnson & Johnson hiring standard.",
    "It contains source metadata and non-verbatim public-safe signals only.",
    "Role, team, seniority, location, and hiring manager can materially change interview emphasis.",
    "This lens requires deeper multi-source validation before being promoted to FULLY_DISTILLED."
  ]
}
