{
  "lens_id": "ibm_public_v0_1",
  "company": "IBM",
  "canonical_company_name": "IBM",
  "lens_status": "LIGHTWEIGHT_SCAN",
  "visibility": "PUBLIC_COMPANY_LENS",
  "version": "0.1.0-public-release-candidate",
  "source_cutoff": "2026-10-19",
  "industries": [
    "technology",
    "enterprise software",
    "cloud",
    "ai consulting"
  ],
  "regions": [
    "north_america",
    "global"
  ],
  "company_stage": "large public enterprise technology, cloud, AI, and consulting company",
  "culture_principles": [
    {
      "name": "Public mission and customer-impact alignment",
      "description": "IBM fit should connect work to the company outcomes and users described in cited public sources.",
      "confidence": 0.72,
      "evidence_ids": [
        "IBM-OFFICIAL-001",
        "IBM-CAREERS-002"
      ]
    },
    {
      "name": "Evidence-backed execution",
      "description": "Strong answers should show practical judgment, clear tradeoffs, ownership, and outcomes rather than generic enthusiasm.",
      "confidence": 0.68,
      "evidence_ids": [
        "IBM-OFFICIAL-001",
        "IBM-CAREERS-002",
        "IBM-IR-003"
      ]
    },
    {
      "name": "Client success as the primary measure",
      "description": "Public values material puts client success first, which means technical elegance is judged by whether the client's operation actually improves.",
      "confidence": 0.72,
      "evidence_ids": [
        "IBM-OFFICIAL-001",
        "IBM-IR-003"
      ]
    },
    {
      "name": "Innovation that has to matter",
      "description": "Research depth is publicly paired with enterprise applicability, so answers should connect novel work to adoption rather than to novelty alone.",
      "confidence": 0.7,
      "evidence_ids": [
        "IBM-OFFICIAL-001",
        "IBM-IR-003"
      ]
    },
    {
      "name": "Trust and personal responsibility",
      "description": "Enterprise and regulated clients make auditability, data handling, and clear ownership part of the engineering brief.",
      "confidence": 0.68,
      "evidence_ids": [
        "IBM-OFFICIAL-001",
        "IBM-CAREERS-002"
      ]
    }
  ],
  "aims_weighting": {
    "structured_thinking": 0.1667,
    "analytical_problem_solving": 0.1667,
    "ownership_execution": 0.1667,
    "impact_results": 0.1667,
    "collaboration_communication": 0.1667,
    "growth_mindset": 0.1665
  },
  "hiring_signals": [
    {
      "signal": "Connects decisions to the users, customers, products, or markets named in public company sources.",
      "aims_dimensions": [
        "impact_results",
        "structured_thinking"
      ],
      "confidence": 0.7,
      "evidence_ids": [
        "IBM-OFFICIAL-001",
        "IBM-CAREERS-002"
      ],
      "basis": "generic_public_default"
    },
    {
      "signal": "Uses concrete examples to show ownership, learning, and measurable improvement.",
      "aims_dimensions": [
        "ownership_execution",
        "analytical_problem_solving",
        "growth_mindset"
      ],
      "confidence": 0.68,
      "evidence_ids": [
        "IBM-OFFICIAL-001",
        "IBM-CAREERS-002",
        "IBM-IR-003"
      ],
      "basis": "generic_public_default"
    },
    {
      "signal": "Frames a technical solution in terms of the client's operating constraint and the metric that improved.",
      "aims_dimensions": [
        "impact_results",
        "structured_thinking"
      ],
      "confidence": 0.72,
      "evidence_ids": [
        "IBM-OFFICIAL-001",
        "IBM-CAREERS-002"
      ],
      "basis": "derived_public_inference"
    },
    {
      "signal": "Explains how a system stays supportable in production, including monitoring, ownership, and upgrade paths.",
      "aims_dimensions": [
        "ownership_execution",
        "analytical_problem_solving"
      ],
      "confidence": 0.7,
      "evidence_ids": [
        "IBM-OFFICIAL-001",
        "IBM-IR-003"
      ],
      "basis": "derived_public_inference"
    },
    {
      "signal": "Shows deliberate skill acquisition when the platform or tooling changed under them.",
      "aims_dimensions": [
        "growth_mindset",
        "collaboration_communication"
      ],
      "confidence": 0.66,
      "evidence_ids": [
        "IBM-CAREERS-002",
        "IBM-OFFICIAL-001"
      ],
      "basis": "derived_public_inference"
    }
  ],
  "anti_signals": [
    {
      "anti_signal": "Generic admiration for the company without a concrete role, customer, product, or business mechanism.",
      "risk_reason": "Public lens usage should stay grounded in cited source signals and role-relevant evidence.",
      "confidence": 0.66,
      "evidence_ids": [
        "IBM-OFFICIAL-001",
        "IBM-CAREERS-002",
        "IBM-IR-003"
      ]
    },
    {
      "anti_signal": "Describing IBM only as an AI or cloud brand without distinguishing consulting, software, infrastructure, and research work.",
      "risk_reason": "Public sources describe materially different role families with different expectations.",
      "confidence": 0.7,
      "evidence_ids": [
        "IBM-OFFICIAL-001",
        "IBM-CAREERS-002"
      ]
    },
    {
      "anti_signal": "Claims about internal values assessments or hiring criteria presented as public fact.",
      "risk_reason": "The lens is built from public-safe source metadata and does not represent an official IBM standard.",
      "confidence": 0.74,
      "evidence_ids": [
        "IBM-CAREERS-002"
      ]
    }
  ],
  "interview_patterns": [
    {
      "pattern": "Use cited public source signals to test role-relevant judgment, ownership, communication, and impact.",
      "role_families": [
        "all"
      ],
      "aims_dimensions": [
        "structured_thinking",
        "ownership_execution",
        "impact_results"
      ],
      "confidence": 0.62
    },
    {
      "pattern": "Hiring signals in this lens are derived interview-preparation suggestions: they translate public company positioning into questions a candidate can prepare for, and are not evidence that the company evaluates candidates on them.",
      "role_families": [
        "all"
      ],
      "aims_dimensions": [
        "growth_mindset",
        "structured_thinking"
      ],
      "confidence": 0.6
    }
  ],
  "evidence_summary": {
    "source_count": 3,
    "official_source_count": 3,
    "interview_source_count": 0,
    "employee_voice_source_count": 0,
    "last_reviewed": "2026-10-19"
  },
  "honest_limits": [
    "This is a lightweight public-source lens and does not represent an official IBM hiring standard.",
    "It contains source metadata and non-verbatim public-safe signals only.",
    "Role, team, seniority, location, and hiring manager can materially change interview emphasis.",
    "This lens requires deeper multi-source validation before being promoted to FULLY_DISTILLED."
  ]
}
