{
  "lens_id": "salesforce_public_v0_1",
  "company": "Salesforce",
  "canonical_company_name": "Salesforce",
  "lens_status": "LIGHTWEIGHT_SCAN",
  "visibility": "PUBLIC_COMPANY_LENS",
  "version": "0.1.0-public-release-candidate",
  "source_cutoff": "2026-10-19",
  "industries": [
    "technology",
    "enterprise software",
    "crm",
    "saas"
  ],
  "regions": [
    "north_america",
    "global"
  ],
  "company_stage": "large public enterprise software company",
  "culture_principles": [
    {
      "name": "Public mission and customer-impact alignment",
      "description": "Salesforce fit should connect work to the company outcomes and users described in cited public sources.",
      "confidence": 0.72,
      "evidence_ids": [
        "SALESFORCE-OFFICIAL-001",
        "SALESFORCE-CAREERS-002"
      ]
    },
    {
      "name": "Evidence-backed execution",
      "description": "Strong answers should show practical judgment, clear tradeoffs, ownership, and outcomes rather than generic enthusiasm.",
      "confidence": 0.68,
      "evidence_ids": [
        "SALESFORCE-OFFICIAL-001",
        "SALESFORCE-CAREERS-002"
      ]
    },
    {
      "name": "Trust as the customer foundation",
      "description": "Public values language places trust first, which for a platform company means security, transparency, and reliability are part of the product rather than support work.",
      "confidence": 0.72,
      "evidence_ids": [
        "SALESFORCE-OFFICIAL-001",
        "SALESFORCE-CULTURE-003"
      ]
    },
    {
      "name": "Learning velocity with new technology",
      "description": "Careers material frames AI fluency as an ongoing learning path, so candidates should show how they actually acquire and apply new tooling.",
      "confidence": 0.7,
      "evidence_ids": [
        "SALESFORCE-CULTURE-003",
        "SALESFORCE-CAREERS-002"
      ]
    },
    {
      "name": "Values expressed through team behaviour",
      "description": "Public material ties values to collaborative, diverse teams, which makes how someone works with others a visible part of performance.",
      "confidence": 0.68,
      "evidence_ids": [
        "SALESFORCE-CULTURE-003",
        "SALESFORCE-OFFICIAL-001"
      ]
    }
  ],
  "aims_weighting": {
    "structured_thinking": 0.1667,
    "analytical_problem_solving": 0.1667,
    "ownership_execution": 0.1667,
    "impact_results": 0.1667,
    "collaboration_communication": 0.1667,
    "growth_mindset": 0.1665
  },
  "hiring_signals": [
    {
      "signal": "Connects decisions to the users, customers, products, or markets named in public company sources.",
      "aims_dimensions": [
        "impact_results",
        "structured_thinking"
      ],
      "confidence": 0.7,
      "evidence_ids": [
        "SALESFORCE-OFFICIAL-001",
        "SALESFORCE-CAREERS-002"
      ]
    },
    {
      "signal": "Uses concrete examples to show ownership, learning, and measurable improvement.",
      "aims_dimensions": [
        "ownership_execution",
        "analytical_problem_solving",
        "growth_mindset"
      ],
      "confidence": 0.68,
      "evidence_ids": [
        "SALESFORCE-OFFICIAL-001",
        "SALESFORCE-CAREERS-002"
      ]
    },
    {
      "signal": "Connects a technical decision to customer trust, data handling, or platform reliability consequences.",
      "aims_dimensions": [
        "structured_thinking",
        "ownership_execution"
      ],
      "confidence": 0.71,
      "evidence_ids": [
        "SALESFORCE-OFFICIAL-001",
        "SALESFORCE-CULTURE-003"
      ]
    },
    {
      "signal": "Shows a concrete example of learning a new platform capability and applying it to a real business problem.",
      "aims_dimensions": [
        "growth_mindset",
        "impact_results"
      ],
      "confidence": 0.72,
      "evidence_ids": [
        "SALESFORCE-CULTURE-003",
        "SALESFORCE-CAREERS-002"
      ]
    },
    {
      "signal": "Describes enabling a customer or partner team to own a solution after handover.",
      "aims_dimensions": [
        "collaboration_communication",
        "impact_results"
      ],
      "confidence": 0.67,
      "evidence_ids": [
        "SALESFORCE-CAREERS-002",
        "SALESFORCE-OFFICIAL-001"
      ]
    }
  ],
  "anti_signals": [
    {
      "anti_signal": "Generic admiration for the company without a concrete role, customer, product, or business mechanism.",
      "risk_reason": "Public lens usage should stay grounded in cited source signals and role-relevant evidence.",
      "confidence": 0.66,
      "evidence_ids": [
        "SALESFORCE-OFFICIAL-001",
        "SALESFORCE-CAREERS-002"
      ]
    },
    {
      "anti_signal": "Reciting Salesforce values or 'Ohana' language without a behavioural example behind it.",
      "risk_reason": "Values language is public, but without behaviour it provides nothing to evaluate.",
      "confidence": 0.7,
      "evidence_ids": [
        "SALESFORCE-CULTURE-003"
      ]
    },
    {
      "anti_signal": "Treating Salesforce as one role family across sales, engineering, success, and ecosystem work.",
      "risk_reason": "Public careers material describes distinct functions with different expectations.",
      "confidence": 0.68,
      "evidence_ids": [
        "SALESFORCE-CAREERS-002",
        "SALESFORCE-CULTURE-003"
      ]
    }
  ],
  "interview_patterns": [
    {
      "pattern": "Use cited public source signals to test role-relevant judgment, ownership, communication, and impact.",
      "role_families": [
        "all"
      ],
      "aims_dimensions": [
        "structured_thinking",
        "ownership_execution",
        "impact_results"
      ],
      "confidence": 0.62
    }
  ],
  "evidence_summary": {
    "source_count": 2,
    "official_source_count": 3,
    "interview_source_count": 0,
    "employee_voice_source_count": 0,
    "last_reviewed": "2026-10-19"
  },
  "honest_limits": [
    "This is a lightweight public-source lens and does not represent an official Salesforce hiring standard.",
    "It contains source metadata and non-verbatim public-safe signals only.",
    "Role, team, seniority, location, and hiring manager can materially change interview emphasis.",
    "This lens requires deeper multi-source validation before being promoted to FULLY_DISTILLED."
  ]
}
