{
  "lens_id": "oracle_public_v0_1",
  "company": "Oracle",
  "canonical_company_name": "Oracle",
  "lens_status": "LIGHTWEIGHT_SCAN",
  "visibility": "PUBLIC_COMPANY_LENS",
  "version": "0.1.0-public-release-candidate",
  "source_cutoff": "2026-10-19",
  "industries": [
    "technology",
    "enterprise software",
    "cloud",
    "database"
  ],
  "regions": [
    "north_america",
    "global"
  ],
  "company_stage": "large public enterprise software, database, and cloud infrastructure company",
  "culture_principles": [
    {
      "name": "Public mission and customer-impact alignment",
      "description": "Oracle fit should connect work to the company outcomes and users described in cited public sources.",
      "confidence": 0.72,
      "evidence_ids": [
        "ORACLE-OFFICIAL-001",
        "ORACLE-CAREERS-002"
      ]
    },
    {
      "name": "Evidence-backed execution",
      "description": "Strong answers should show practical judgment, clear tradeoffs, ownership, and outcomes rather than generic enthusiasm.",
      "confidence": 0.68,
      "evidence_ids": [
        "ORACLE-OFFICIAL-001",
        "ORACLE-CAREERS-002",
        "ORACLE-IR-003"
      ]
    },
    {
      "name": "Ownership of the full customer outcome",
      "description": "Public material positions Oracle across cloud infrastructure, applications, and databases that customers rely on in production, so partial delivery is visible to the customer.",
      "confidence": 0.7,
      "evidence_ids": [
        "ORACLE-OFFICIAL-001",
        "ORACLE-IR-003"
      ]
    },
    {
      "name": "Operating reliability over novelty",
      "description": "Enterprise customers run mission-critical workloads on the platform, which makes availability, migration risk, and support paths central to any proposal.",
      "confidence": 0.69,
      "evidence_ids": [
        "ORACLE-OFFICIAL-001",
        "ORACLE-IR-003"
      ]
    },
    {
      "name": "Stated culture of connection and community",
      "description": "Oracle's public impact material describes a culture of connection and community intended to let employees do their best work.",
      "confidence": 0.63,
      "evidence_ids": [
        "ORACLE-CITIZENSHIP-004",
        "ORACLE-OFFICIAL-001"
      ]
    }
  ],
  "aims_weighting": {
    "structured_thinking": 0.1667,
    "analytical_problem_solving": 0.1667,
    "ownership_execution": 0.1667,
    "impact_results": 0.1667,
    "collaboration_communication": 0.1667,
    "growth_mindset": 0.1665
  },
  "hiring_signals": [
    {
      "signal": "Connects decisions to the users, customers, products, or markets named in public company sources.",
      "aims_dimensions": [
        "impact_results",
        "structured_thinking"
      ],
      "confidence": 0.7,
      "evidence_ids": [
        "ORACLE-OFFICIAL-001",
        "ORACLE-CAREERS-002"
      ]
    },
    {
      "signal": "Uses concrete examples to show ownership, learning, and measurable improvement.",
      "aims_dimensions": [
        "ownership_execution",
        "analytical_problem_solving",
        "growth_mindset"
      ],
      "confidence": 0.68,
      "evidence_ids": [
        "ORACLE-OFFICIAL-001",
        "ORACLE-CAREERS-002",
        "ORACLE-IR-003"
      ]
    },
    {
      "signal": "Explains a migration or platform change with an explicit rollback path and cutover evidence.",
      "aims_dimensions": [
        "structured_thinking",
        "ownership_execution"
      ],
      "confidence": 0.72,
      "evidence_ids": [
        "ORACLE-OFFICIAL-001",
        "ORACLE-IR-003"
      ]
    },
    {
      "signal": "Describes a customer escalation they owned end to end, including the support handoff afterwards.",
      "aims_dimensions": [
        "ownership_execution",
        "collaboration_communication"
      ],
      "confidence": 0.68,
      "evidence_ids": [
        "ORACLE-CAREERS-002",
        "ORACLE-OFFICIAL-001"
      ]
    },
    {
      "signal": "Raises a compliance, data handling, or licensing constraint before it becomes a delivery problem.",
      "aims_dimensions": [
        "structured_thinking",
        "growth_mindset"
      ],
      "confidence": 0.66,
      "evidence_ids": [
        "ORACLE-CITIZENSHIP-004",
        "ORACLE-CAREERS-002"
      ]
    }
  ],
  "anti_signals": [
    {
      "anti_signal": "Generic admiration for the company without a concrete role, customer, product, or business mechanism.",
      "risk_reason": "Public lens usage should stay grounded in cited source signals and role-relevant evidence.",
      "confidence": 0.66,
      "evidence_ids": [
        "ORACLE-OFFICIAL-001",
        "ORACLE-CAREERS-002",
        "ORACLE-IR-003"
      ]
    },
    {
      "anti_signal": "Treating Oracle as a single database product and ignoring cloud infrastructure, applications, and industry solutions.",
      "risk_reason": "Public sources describe multiple product and role families with different expectations.",
      "confidence": 0.7,
      "evidence_ids": [
        "ORACLE-OFFICIAL-001",
        "ORACLE-CAREERS-002"
      ]
    },
    {
      "anti_signal": "Recommending a platform change without addressing migration cost, downtime, or skills transfer.",
      "risk_reason": "Enterprise continuity is a public platform promise, so an unqualified migration claim cannot be evaluated.",
      "confidence": 0.68,
      "evidence_ids": [
        "ORACLE-IR-003"
      ]
    }
  ],
  "interview_patterns": [
    {
      "pattern": "Use cited public source signals to test role-relevant judgment, ownership, communication, and impact.",
      "role_families": [
        "all"
      ],
      "aims_dimensions": [
        "structured_thinking",
        "ownership_execution",
        "impact_results"
      ],
      "confidence": 0.62
    }
  ],
  "evidence_summary": {
    "source_count": 4,
    "official_source_count": 4,
    "interview_source_count": 0,
    "employee_voice_source_count": 0,
    "last_reviewed": "2026-10-19"
  },
  "honest_limits": [
    "This is a lightweight public-source lens and does not represent an official Oracle hiring standard.",
    "It contains source metadata and non-verbatim public-safe signals only.",
    "Role, team, seniority, location, and hiring manager can materially change interview emphasis.",
    "This lens requires deeper multi-source validation before being promoted to FULLY_DISTILLED."
  ]
}
